{
  "suite_version": "0.1.0",
  "round": "SCA-02",
  "domains": [
    "D16",
    "D17",
    "D18"
  ],
  "case_count": 216,
  "cases": [
    {
      "case_id": "P-sys.business_entrepreneurship.business_strategy-zh",
      "case_type": "POSITIVE",
      "language": "zh",
      "text": "我想处理商业战略相关的问题，重点是竞争优势和业务方向，帮我梳理判断与下一步。",
      "expected_topic_id": "sys.business_entrepreneurship.business_strategy",
      "source_topic_id": "sys.business_entrepreneurship.business_strategy",
      "distractor_topic_id": null,
      "edge_id": null,
      "provenance": {
        "source_classes": [
          "DERIVED_SEMANTIC_PROFILE"
        ],
        "generator": "GPT-5.6 Sol / SCA-02",
        "formal_fields_overridden": false
      }
    },
    {
      "case_id": "P-sys.business_entrepreneurship.business_strategy-en",
      "case_type": "POSITIVE",
      "language": "en",
      "text": "Help me with business strategy, especially business strategy and competitive advantage.",
      "expected_topic_id": "sys.business_entrepreneurship.business_strategy",
      "source_topic_id": "sys.business_entrepreneurship.business_strategy",
      "distractor_topic_id": null,
      "edge_id": null,
      "provenance": {
        "source_classes": [
          "DERIVED_SEMANTIC_PROFILE"
        ],
        "generator": "GPT-5.6 Sol / SCA-02",
        "formal_fields_overridden": false
      }
    },
    {
      "case_id": "P-sys.business_entrepreneurship.customer_feedback-zh",
      "case_type": "POSITIVE",
      "language": "zh",
      "text": "我想处理客户反馈与客服相关的问题，重点是客户反馈和客服，帮我梳理判断与下一步。",
      "expected_topic_id": "sys.business_entrepreneurship.customer_feedback",
      "source_topic_id": "sys.business_entrepreneurship.customer_feedback",
      "distractor_topic_id": null,
      "edge_id": null,
      "provenance": {
        "source_classes": [
          "DERIVED_SEMANTIC_PROFILE"
        ],
        "generator": "GPT-5.6 Sol / SCA-02",
        "formal_fields_overridden": false
      }
    },
    {
      "case_id": "P-sys.business_entrepreneurship.customer_feedback-en",
      "case_type": "POSITIVE",
      "language": "en",
      "text": "Help me with customer feedback & support, especially customer feedback and support.",
      "expected_topic_id": "sys.business_entrepreneurship.customer_feedback",
      "source_topic_id": "sys.business_entrepreneurship.customer_feedback",
      "distractor_topic_id": null,
      "edge_id": null,
      "provenance": {
        "source_classes": [
          "DERIVED_SEMANTIC_PROFILE"
        ],
        "generator": "GPT-5.6 Sol / SCA-02",
        "formal_fields_overridden": false
      }
    },
    {
      "case_id": "P-sys.business_entrepreneurship.entrepreneurship-zh",
      "case_type": "POSITIVE",
      "language": "zh",
      "text": "我想处理创业相关的问题，重点是创业项目和创始人，帮我梳理判断与下一步。",
      "expected_topic_id": "sys.business_entrepreneurship.entrepreneurship",
      "source_topic_id": "sys.business_entrepreneurship.entrepreneurship",
      "distractor_topic_id": null,
      "edge_id": null,
      "provenance": {
        "source_classes": [
          "DERIVED_SEMANTIC_PROFILE"
        ],
        "generator": "GPT-5.6 Sol / SCA-02",
        "formal_fields_overridden": false
      }
    },
    {
      "case_id": "P-sys.business_entrepreneurship.entrepreneurship-en",
      "case_type": "POSITIVE",
      "language": "en",
      "text": "Help me with entrepreneurship, especially entrepreneurship and startup.",
      "expected_topic_id": "sys.business_entrepreneurship.entrepreneurship",
      "source_topic_id": "sys.business_entrepreneurship.entrepreneurship",
      "distractor_topic_id": null,
      "edge_id": null,
      "provenance": {
        "source_classes": [
          "DERIVED_SEMANTIC_PROFILE"
        ],
        "generator": "GPT-5.6 Sol / SCA-02",
        "formal_fields_overridden": false
      }
    },
    {
      "case_id": "P-sys.business_entrepreneurship.market_research-zh",
      "case_type": "POSITIVE",
      "language": "zh",
      "text": "我想处理市场研究相关的问题，重点是行业研究和市场规模，帮我梳理判断与下一步。",
      "expected_topic_id": "sys.business_entrepreneurship.market_research",
      "source_topic_id": "sys.business_entrepreneurship.market_research",
      "distractor_topic_id": null,
      "edge_id": null,
      "provenance": {
        "source_classes": [
          "DERIVED_SEMANTIC_PROFILE"
        ],
        "generator": "GPT-5.6 Sol / SCA-02",
        "formal_fields_overridden": false
      }
    },
    {
      "case_id": "P-sys.business_entrepreneurship.market_research-en",
      "case_type": "POSITIVE",
      "language": "en",
      "text": "Help me with market research, especially market research and market size.",
      "expected_topic_id": "sys.business_entrepreneurship.market_research",
      "source_topic_id": "sys.business_entrepreneurship.market_research",
      "distractor_topic_id": null,
      "edge_id": null,
      "provenance": {
        "source_classes": [
          "DERIVED_SEMANTIC_PROFILE"
        ],
        "generator": "GPT-5.6 Sol / SCA-02",
        "formal_fields_overridden": false
      }
    },
    {
      "case_id": "P-sys.business_entrepreneurship.marketing_growth-zh",
      "case_type": "POSITIVE",
      "language": "zh",
      "text": "我想处理营销与增长相关的问题，重点是营销和增长，帮我梳理判断与下一步。",
      "expected_topic_id": "sys.business_entrepreneurship.marketing_growth",
      "source_topic_id": "sys.business_entrepreneurship.marketing_growth",
      "distractor_topic_id": null,
      "edge_id": null,
      "provenance": {
        "source_classes": [
          "DERIVED_SEMANTIC_PROFILE"
        ],
        "generator": "GPT-5.6 Sol / SCA-02",
        "formal_fields_overridden": false
      }
    },
    {
      "case_id": "P-sys.business_entrepreneurship.marketing_growth-en",
      "case_type": "POSITIVE",
      "language": "en",
      "text": "Help me with marketing & growth, especially marketing and growth.",
      "expected_topic_id": "sys.business_entrepreneurship.marketing_growth",
      "source_topic_id": "sys.business_entrepreneurship.marketing_growth",
      "distractor_topic_id": null,
      "edge_id": null,
      "provenance": {
        "source_classes": [
          "DERIVED_SEMANTIC_PROFILE"
        ],
        "generator": "GPT-5.6 Sol / SCA-02",
        "formal_fields_overridden": false
      }
    },
    {
      "case_id": "P-sys.business_entrepreneurship.operations_process-zh",
      "case_type": "POSITIVE",
      "language": "zh",
      "text": "我想处理业务运营与流程相关的问题，重点是业务运营和流程，帮我梳理判断与下一步。",
      "expected_topic_id": "sys.business_entrepreneurship.operations_process",
      "source_topic_id": "sys.business_entrepreneurship.operations_process",
      "distractor_topic_id": null,
      "edge_id": null,
      "provenance": {
        "source_classes": [
          "DERIVED_SEMANTIC_PROFILE"
        ],
        "generator": "GPT-5.6 Sol / SCA-02",
        "formal_fields_overridden": false
      }
    },
    {
      "case_id": "P-sys.business_entrepreneurship.operations_process-en",
      "case_type": "POSITIVE",
      "language": "en",
      "text": "Help me with operations & process, especially operations and process.",
      "expected_topic_id": "sys.business_entrepreneurship.operations_process",
      "source_topic_id": "sys.business_entrepreneurship.operations_process",
      "distractor_topic_id": null,
      "edge_id": null,
      "provenance": {
        "source_classes": [
          "DERIVED_SEMANTIC_PROFILE"
        ],
        "generator": "GPT-5.6 Sol / SCA-02",
        "formal_fields_overridden": false
      }
    },
    {
      "case_id": "P-sys.business_entrepreneurship.partnerships-zh",
      "case_type": "POSITIVE",
      "language": "zh",
      "text": "我想处理商务合作相关的问题，重点是合作伙伴和渠道合作，帮我梳理判断与下一步。",
      "expected_topic_id": "sys.business_entrepreneurship.partnerships",
      "source_topic_id": "sys.business_entrepreneurship.partnerships",
      "distractor_topic_id": null,
      "edge_id": null,
      "provenance": {
        "source_classes": [
          "DERIVED_SEMANTIC_PROFILE"
        ],
        "generator": "GPT-5.6 Sol / SCA-02",
        "formal_fields_overridden": false
      }
    },
    {
      "case_id": "P-sys.business_entrepreneurship.partnerships-en",
      "case_type": "POSITIVE",
      "language": "en",
      "text": "Help me with partnerships, especially partnership and business partner.",
      "expected_topic_id": "sys.business_entrepreneurship.partnerships",
      "source_topic_id": "sys.business_entrepreneurship.partnerships",
      "distractor_topic_id": null,
      "edge_id": null,
      "provenance": {
        "source_classes": [
          "DERIVED_SEMANTIC_PROFILE"
        ],
        "generator": "GPT-5.6 Sol / SCA-02",
        "formal_fields_overridden": false
      }
    },
    {
      "case_id": "P-sys.business_entrepreneurship.sales-zh",
      "case_type": "POSITIVE",
      "language": "zh",
      "text": "我想处理商务与销售相关的问题，重点是销售和客户开发，帮我梳理判断与下一步。",
      "expected_topic_id": "sys.business_entrepreneurship.sales",
      "source_topic_id": "sys.business_entrepreneurship.sales",
      "distractor_topic_id": null,
      "edge_id": null,
      "provenance": {
        "source_classes": [
          "DERIVED_SEMANTIC_PROFILE"
        ],
        "generator": "GPT-5.6 Sol / SCA-02",
        "formal_fields_overridden": false
      }
    },
    {
      "case_id": "P-sys.business_entrepreneurship.sales-en",
      "case_type": "POSITIVE",
      "language": "en",
      "text": "Help me with sales, especially sales and lead.",
      "expected_topic_id": "sys.business_entrepreneurship.sales",
      "source_topic_id": "sys.business_entrepreneurship.sales",
      "distractor_topic_id": null,
      "edge_id": null,
      "provenance": {
        "source_classes": [
          "DERIVED_SEMANTIC_PROFILE"
        ],
        "generator": "GPT-5.6 Sol / SCA-02",
        "formal_fields_overridden": false
      }
    },
    {
      "case_id": "P-sys.knowledge_memory.backup_export-zh",